{"$defs":{"simProvider":{"additionalProperties":false,"properties":{"description":{"description":"Optional human-readable description of the provider.","type":"string"},"providerId":{"description":"Identifier referenced by the simulation graph.","pattern":"^[A-Za-z0-9_.-]+$","type":"string"},"settings":{"additionalProperties":{"$ref":"#/$defs/value"},"default":{},"description":"Provider-specific tunables.","type":"object"},"topics":{"description":"Topics emitted by the provider.","items":{"pattern":"^[A-Za-z0-9_.-]+$","type":"string"},"minItems":1,"type":"array","uniqueItems":true},"type":{"description":"Fully qualified type name used to materialise the provider.","minLength":1,"type":"string"}},"required":["providerId","type","topics"],"type":"object"},"value":{"anyOf":[{"type":"string"},{"type":"number"},{"type":"boolean"},{"items":{"type":"number"},"type":"array"}]}},"$id":"https://agopengps.org/schemas/plugin.schema.json","$schema":"https://json-schema.org/draft/2020-12/schema","additionalProperties":false,"properties":{"description":{"description":"Long-form summary of the plugin's capabilities.","type":"string"},"id":{"description":"Reverse-DNS identifier for the plugin bundle.","pattern":"^[a-z0-9]+(\\.[a-z0-9_-]+)+$","type":"string"},"name":{"description":"Display name shown in catalogs and diagnostics.","minLength":1,"type":"string"},"requiredApis":{"additionalProperties":{"type":"string"},"description":"Compatibility map keyed by API name with semantic version constraints.","minProperties":1,"type":"object"},"schemaVersion":{"description":"Semantic version of the plugin manifest schema.","pattern":"^1\\.\\d+\\.\\d+$","type":"string"},"settings":{"additionalProperties":{"$ref":"#/$defs/value"},"default":{},"description":"Optional plugin-level settings surfaced to the host.","type":"object"},"simProviders":{"description":"Simulation providers bundled with the plugin.","items":{"$ref":"#/$defs/simProvider"},"minItems":1,"type":"array"},"version":{"description":"Semantic version describing the plugin implementation.","pattern":"^(0|[1-9]\\d*)\\.(0|[1-9]\\d*)\\.(0|[1-9]\\d*)(?:-[-0-9A-Za-z.]+)?(?:\\+[0-9A-Za-z.-]+)?$","type":"string"}},"required":["schemaVersion","id","name","version","requiredApis","simProviders"],"title":"Nexus plugin manifest","type":"object"}
