{"description":"Manages job lifecycle persistence, TaskService work orders, and resume autosave.","id":"org.agopengps.plugins.job-tasks","name":"Job Tasks","requiredApis":{"core":">=1.0.0"},"schemaVersion":"1.0.0","settings":{"autosaveIntervalSeconds":60,"resumeFileName":"Resume.txt"},"simProviders":[{"description":"Simulates session save/resume events for regression scenarios.","providerId":"jobTasks.sessionAutosave","settings":{"intervalSeconds":120},"topics":["jobTasks.autosave"],"type":"Aog.Plugins.JobTasks.Simulation.SessionAutosaveProvider"}],"version":"1.0.0"}
