{"description":"Provides deterministic replay streams for guidance and pose overlays.","id":"org.agopengps.plugins.replay","name":"Replay Toolkit","requiredApis":{"core":">=1.0.0","sim":">=1.0.0"},"schemaVersion":"1.0.0","settings":{"defaultRecording":"~/telemetry/guidance.parquet"},"simProviders":[{"description":"Plays back logged guidance commands for comparison runs.","providerId":"replay.guidance","settings":{"loop":true},"topics":["guidance.replay.command"],"type":"Aog.Plugins.Replay.GuidanceProvider"},{"description":"Streams recorded pose data for overlay and regression analysis.","providerId":"replay.pose","settings":{"timeScale":1},"topics":["vehicle.replay.pose"],"type":"Aog.Plugins.Replay.PoseProvider"}],"version":"1.0.0"}
